"PDF"	"Accepted as"	"Title"	"Authors"	"Keywords"	"Abstract"
"https://openreview.net/pdf?id=Hkxzx0NtDB"	"oral"	"Your classifier is secretly an energy based model and you should treat it like one"	"Will Grathwohl, Kuan-Chieh Wang, Joern-Henrik Jacobsen, David Duvenaud, Mohammad Norouzi, Kevin Swersky"	"energy based models; adversarial robustness; generative models; out of distribution detection; outlier detection; hybrid models; robustness; calibration"	"We propose to reinterpret a standard discriminative classifier of p(y|x) as an energy based model for the joint distribution p(x, y). In this setting, the standard class probabilities can be easily computed as well as unnormalized values of p(x) and p(x|y). Within this framework, standard discriminative architectures may be used and the model can also be trained on unlabeled data. We demonstrate that energy based training of the joint distribution improves calibration, robustness, and out-of-distribution detection while also enabling our models to generate samples rivaling the quality of recent GAN approaches. We improve upon recently proposed techniques for scaling up the training of energy based models and present an approach which adds little overhead compared to standard classification training. Our approach is the first to achieve performance rivaling the state-of-the-art in both generative and discriminative learning within one hybrid model."
"https://openreview.net/pdf?id=SJxSDxrKDr"	"oral"	"Adversarial Training and Provable Defenses: Bridging the Gap"	"Mislav Balunovic, Martin Vechev"	"adversarial examples; adversarial training; provable defense; convex relaxations; deep learning"	"We present COLT, a new method to train neural networks based on a novel combination of adversarial training and provable defenses. The key idea is to model neural network training as a procedure which includes both, the verifier and the adversary. In every iteration, the verifier aims to certify the network using convex relaxation while the adversary tries to find inputs inside that convex relaxation which cause verification to fail. We experimentally show that this training method, named convex layerwise adversarial training (COLT), is promising and achieves the best of both worlds -- it produces a state-of-the-art neural network with certified robustness of 60.5% and accuracy of 78.4% on the challenging CIFAR-10 dataset with a 2/255 L-infinity perturbation. This significantly improves over the best concurrent results of 54.0% certified robustness and 71.5% accuracy."
"https://openreview.net/pdf?id=B1e9Y2NYvS"	"spotlight"	"On Robustness of Neural Ordinary Differential Equations"	"Hanshu YAN, Jiawei DU, Vincent TAN, Jiashi FENG"	"Neural ODE"	"Neural ordinary differential equations (ODEs) have been attracting increasing attention in various research domains recently. There have been some works studying optimization issues and approximation capabilities of neural ODEs, but their robustness is still yet unclear. In this work, we fill this important gap by exploring robustness properties of neural ODEs both empirically and theoretically. We first present an empirical study on the robustness of the neural ODE-based networks (ODENets) by exposing them to inputs with various types of perturbations and subsequently investigating the changes of the corresponding outputs. In contrast to conventional convolutional neural networks (CNNs), we find that the ODENets are more robust against both random Gaussian perturbations and adversarial attack examples. We then provide an insightful understanding of this phenomenon by exploiting a certain desirable property of the flow of a continuous-time ODE, namely that integral curves are non-intersecting. Our work suggests that, due to their intrinsic robustness, it is promising to use neural ODEs as a basic block for building robust deep network models. To further enhance the robustness of vanilla neural ODEs, we propose the time-invariant steady neural ODE (TisODE), which regularizes the flow on perturbed data via the time-invariant property and the imposition of a steady-state constraint. We show that the TisODE method outperforms vanilla neural ODEs and also can work in conjunction with other state-of-the-art architectural methods to build more robust deep networks."
"https://openreview.net/pdf?id=H1xscnEKDr"	"spotlight"	"Defending Against Physically Realizable Attacks on Image Classification"	"Tong Wu, Liang Tong, Yevgeniy Vorobeychik"	"defense against physical attacks; adversarial machine learning"	"We study the problem of defending deep neural network approaches for image classification from physically realizable attacks. First, we demonstrate that the two most scalable and effective methods for learning robust models, adversarial training with PGD attacks and randomized smoothing, exhibit very limited effectiveness against three of the highest profile physical attacks. Next, we propose a new abstract adversarial model, rectangular occlusion attacks, in which an adversary places a small adversarially crafted rectangle in an image, and develop two approaches for efficiently computing the resulting adversarial examples. Finally, we demonstrate that adversarial training using our new attack yields image classification models that exhibit high robustness against the physically realizable attacks we study, offering the first effective generic defense against such attacks."
"https://openreview.net/pdf?id=BJlRs34Fvr"	"spotlight"	"Skip Connections Matter: On the Transferability of Adversarial Examples Generated with ResNets"	"Dongxian Wu, Yisen Wang, Shu-Tao Xia, James Bailey, Xingjun Ma"	"Adversarial Example; Transferability; Skip Connection; Neural Network"	"Skip connections are an essential component of current state-of-the-art deep neural networks (DNNs) such as ResNet, WideResNet, DenseNet, and ResNeXt. Despite their huge success in building deeper and more powerful DNNs, we identify a surprising \emph{security weakness} of skip connections in this paper. Use of skip connections \textit{allows easier generation of highly transferable adversarial examples}. Specifically, in ResNet-like (with skip connections) neural networks, gradients can backpropagate through either skip connections or residual modules. We find that using more gradients from the skip connections rather than the residual modules according to a decay factor, allows one to craft adversarial examples with high transferability. Our method is termed \emph{Skip Gradient Method} (SGM). We conduct comprehensive transfer attacks against state-of-the-art DNNs including ResNets, DenseNets, Inceptions, Inception-ResNet, Squeeze-and-Excitation Network (SENet) and robustly trained DNNs. We show that employing SGM on the gradient flow can greatly improve the transferability of crafted attacks in almost all cases. Furthermore, SGM can be easily combined with existing black-box attack techniques, and obtain high improvements over state-of-the-art transferability methods. Our findings not only motivate new research into the architectural vulnerability of DNNs, but also open up further challenges for the design of secure DNN architectures."
"https://openreview.net/pdf?id=H1ebhnEYDH"	"spotlight"	"White Noise Analysis of Neural Networks"	"Ali Borji, Sikun Lin"	"Classification images; spike triggered analysis; deep learning; network visualization; adversarial attack; adversarial defense; microstimulation; computational neuroscience"	"A white noise analysis of modern deep neural networks is presented to unveil their biases at the whole network level or the single neuron level. Our analysis is based on two popular and related methods in psychophysics and neurophysiology namely classification images and spike triggered analysis. These methods have been widely used to understand the underlying mechanisms of sensory systems in humans and monkeys. We leverage them to investigate the inherent biases of deep neural networks and to obtain a first-order approximation of their functionality. We emphasize on CNNs since they are currently the state of the art methods in computer vision and are a decent model of human visual processing. In addition, we study multi-layer perceptrons, logistic regression, and recurrent neural networks. Experiments over four classic datasets, MNIST, Fashion-MNIST, CIFAR-10, and ImageNet, show that the computed bias maps resemble the target classes and when used for classification lead to an over two-fold performance than the chance level. Further, we show that classification images can be used to attack a black-box classifier and to detect adversarial patch attacks. Finally, we utilize spike triggered averaging to derive the filters of CNNs and explore how the behavior of a network changes when neurons in different layers are modulated. Our effort illustrates a successful example of borrowing from neurosciences to study ANNs and highlights the importance of cross-fertilization and synergy across machine learning, deep learning, and computational neuroscience."
"https://openreview.net/pdf?id=Skgvy64tvr"	"spotlight"	"Enhancing Adversarial Defense by k-Winners-Take-All"	"Chang Xiao, Peilin Zhong, Changxi Zheng"	"adversarial defense; activation function; winner takes all"	"We propose a simple change to existing neural network structures for better defending against gradient-based adversarial attacks. Instead of using popular activation functions (such as ReLU), we advocate the use of k-Winners-Take-All (k-WTA) activation, a C0 discontinuous function that purposely invalidates the neural network model’s gradient at densely distributed input data points. The proposed k-WTA activation can be readily used in nearly all existing networks and training methods with no significant overhead. Our proposal is theoretically rationalized. We analyze why the discontinuities in k-WTA networks can largely prevent gradient-based search of adversarial examples and why they at the same time remain innocuous to the network training. This understanding is also empirically backed. We test k-WTA activation on various network structures optimized by a training method, be it adversarial training or not. In all cases, the robustness of k-WTA networks outperforms that of traditional networks under white-box attacks."
"https://openreview.net/pdf?id=BJg866NFvB"	"spotlight"	"Estimating counterfactual treatment outcomes over time through adversarially balanced representations"	"Ioana Bica, Ahmed M Alaa, James Jordon, Mihaela van der Schaar"	"treatment effects over time; causal inference; counterfactual estimation"	"Identifying when to give treatments to patients and how to select among multiple treatments over time are important medical problems with a few existing solutions. In this paper, we introduce the Counterfactual Recurrent Network (CRN), a novel sequence-to-sequence model that leverages the increasingly available patient observational data to estimate treatment effects over time and answer such medical questions. To handle the bias from time-varying confounders, covariates affecting the treatment assignment policy in the observational data, CRN uses domain adversarial training to build balancing representations of the patient history. At each timestep, CRN constructs a treatment invariant representation which removes the association between patient history and treatment assignments and thus can be reliably used for making counterfactual predictions. On a simulated model of tumour growth, with varying degree of time-dependent confounding, we show how our model achieves lower error in estimating counterfactuals and in choosing the correct treatment and timing of treatment than current state-of-the-art methods."
"https://openreview.net/pdf?id=BygzbyHFvB"	"spotlight"	"FreeLB: Enhanced Adversarial Training for Natural Language Understanding"	"Chen Zhu, Yu Cheng, Zhe Gan, Siqi Sun, Tom Goldstein, Jingjing Liu"	"--"	"Adversarial training, which minimizes the maximal risk for label-preserving input perturbations, has proved to be effective for improving the generalization of language models. In this work, we propose a novel adversarial training algorithm, FreeLB, that promotes higher invariance in the embedding space, by adding adversarial perturbations to word embeddings and minimizing the resultant adversarial risk inside different regions around input samples. To validate the effectiveness of the proposed approach, we apply it to Transformer-based models for natural language understanding and commonsense reasoning tasks. Experiments on the GLUE benchmark show that when applied only to the finetuning stage, it is able to improve the overall test scores of BERT-base model from 78.3 to 79.4, and RoBERTa-large model from 88.5 to 88.8. In addition, the proposed approach achieves state-of-the-art single-model test accuracies of 85.44% and 67.75% on ARC-Easy and ARC-Challenge. Experiments on CommonsenseQA benchmark further demonstrate that FreeLB can be generalized and boost the performance of RoBERTa-large model on other tasks as well."
"https://openreview.net/pdf?id=rJgsskrFwH"	"spotlight"	"Scaling Autoregressive Video Models"	"Dirk Weissenborn, Oscar Täckström, Jakob Uszkoreit"	"autoregressive models; video prediction; generative models; video generation"	"Due to the statistical complexity of video, the high degree of inherent stochasticity, and the sheer amount of data, generating natural video remains a challenging task. State-of-the-art video generation models attempt to address these issues by combining sometimes complex, often video-specific neural network architectures, latent variable models, adversarial training and a range of other methods. Despite their often high complexity, these approaches still fall short of generating high quality video continuations outside of narrow domains and often struggle with fidelity. In contrast, we show that conceptually simple, autoregressive video generation models based on a three-dimensional self-attention mechanism achieve highly competitive results across multiple metrics on popular benchmark datasets for which they produce continuations of high fidelity and realism. Furthermore, we find that our models are capable of producing diverse and surprisingly realistic continuations on a subset of videos from Kinetics, a large scale action recognition dataset comprised of YouTube videos exhibiting phenomena such as camera movement, complex object interactions and diverse human movement. To our knowledge, this is the first promising application of video-generation models to videos of this complexity."
"https://openreview.net/pdf?id=B1gdkxHFDH"	"spotlight"	"Training individually fair ML models with sensitive subspace robustness"	"Mikhail Yurochkin, Amanda Bower, Yuekai Sun"	"fairness; adversarial robustness"	"We consider training machine learning models that are fair in the sense that their performance is invariant under certain sensitive perturbations to the inputs. For example, the performance of a resume screening system should be invariant under changes to the gender and/or ethnicity of the applicant. We formalize this notion of algorithmic fairness as a variant of individual fairness and develop a distributionally robust optimization approach to enforce it during training. We also demonstrate the effectiveness of the approach on two ML tasks that are susceptible to gender and racial biases."
"https://openreview.net/pdf?id=rJxAo2VYwr"	"poster"	"Transferable Perturbations of Deep Feature Distributions"	"Nathan Inkawhich, Kevin Liang, Lawrence Carin, Yiran Chen"	"adversarial attacks; transferability; interpretability"	"Almost all current adversarial attacks of CNN classifiers rely on information derived from the output layer of the network. This work presents a new adversarial attack based on the modeling and exploitation of class-wise and layer-wise deep feature distributions. We achieve state-of-the-art targeted blackbox transfer-based attack results for undefended ImageNet models. Further, we place a priority on explainability and interpretability of the attacking process. Our methodology affords an analysis of how adversarial attacks change the intermediate feature distributions of CNNs, as well as a measure of layer-wise and class-wise feature distributional separability/entanglement. We also conceptualize a transition from task/data-specific to model-specific features within a CNN architecture that directly impacts the transferability of adversarial examples."
"https://openreview.net/pdf?id=BkgWahEFvr"	"poster"	"Enhancing Transformation-Based Defenses Against Adversarial Attacks with a Distribution Classifier"	"Connie Kou, Hwee Kuan Lee, Ee-Chien Chang, Teck Khim Ng"	"adversarial attack; transformation defenses; distribution classifier"	"Adversarial attacks on convolutional neural networks (CNN) have gained significant attention and there have been active research efforts on defense mechanisms. Stochastic input transformation methods have been proposed, where the idea is to recover the image from adversarial attack by random transformation, and to take the majority vote as consensus among the random samples. However, the transformation improves the accuracy on adversarial images at the expense of the accuracy on clean images. While it is intuitive that the accuracy on clean images would deteriorate, the exact mechanism in which how this occurs is unclear. In this paper, we study the distribution of softmax induced by stochastic transformations. We observe that with random transformations on the clean images, although the mass of the softmax distribution could shift to the wrong class, the resulting distribution of softmax could be used to correct the prediction. Furthermore, on the adversarial counterparts, with the image transformation, the resulting shapes of the distribution of softmax are similar to the distributions from the clean images. With these observations, we propose a method to improve existing transformation-based defenses. We train a separate lightweight distribution classifier to recognize distinct features in the distributions of softmax outputs of transformed images. Our empirical studies show that our distribution classifier, by training on distributions obtained from clean images only, outperforms majority voting for both clean and adversarial images. Our method is generic and can be integrated with existing transformation-based defenses."
"https://openreview.net/pdf?id=HkgTTh4FDH"	"poster"	"Implicit Bias of Gradient Descent based Adversarial Training on Separable Data"	"Yan Li, Ethan X.Fang, Huan Xu, Tuo Zhao"	"implicit bias; adversarial training; robustness; gradient descent"	"Adversarial training is a principled approach for training robust neural networks. Despite of tremendous successes in practice, its theoretical properties still remain largely unexplored. In this paper, we provide new theoretical insights of gradient descent based adversarial training by studying its computational properties, specifically on its implicit bias. We take the binary classification task on linearly separable data as an illustrative example, where the loss asymptotically attains its infimum as the parameter diverges to infinity along certain directions. Specifically, we show that for any fixed iteration T , when the adversarial perturbation during training has proper bounded L2 norm, the classifier learned by gradient descent based adversarial training converges in direction to the maximum L2 norm margin classifier at the rate of O ( 1 / T ) , significantly faster than the rate O(1/\log T} O(1/\log T} of training with clean data. In addition, when the adversarial perturbation during training has bounded Lq norm, the resulting classifier converges in direction to a maximum mixed-norm margin classifier, which has a natural interpretation of robustness, as being the maximum L2 norm margin classifier under worst-case bounded Lq norm perturbation to the data. Our findings provide theoretical backups for adversarial training that it indeed promotes robustness against adversarial perturbation."
"https://openreview.net/pdf?id=ByxtC2VtPB"	"poster"	"Mixup Inference: Better Exploiting Mixup to Defend Adversarial Attacks"	"Tianyu Pang*, Kun Xu*, Jun Zhu"	"Trustworthy Machine Learning; Adversarial Robustness; Inference Principle; Mixup"	"It has been widely recognized that adversarial examples can be easily crafted to fool deep networks, which mainly root from the locally non-linear behavior nearby input examples. Applying mixup in training provides an effective mechanism to improve generalization performance and model robustness against adversarial perturbations, which introduces the globally linear behavior in-between training examples. However, in previous work, the mixup-trained models only passively defend adversarial attacks in inference by directly classifying the inputs, where the induced global linearity is not well exploited. Namely, since the locality of the adversarial perturbations, it would be more efficient to actively break the locality via the globality of the model predictions. Inspired by simple geometric intuition, we develop an inference principle, named mixup inference (MI), for mixup-trained models. MI mixups the input with other random clean samples, which can shrink and transfer the equivalent perturbation if the input is adversarial. Our experiments on CIFAR-10 and CIFAR-100 demonstrate that MI can further improve the adversarial robustness for the models trained by mixup and its variants."
"https://openreview.net/pdf?id=Byg9A24tvB"	"poster"	"Rethinking Softmax Cross-Entropy Loss for Adversarial Robustness"	"Tianyu Pang, Kun Xu, Yinpeng Dong, Chao Du, Ning Chen, Jun Zhu"	"Trustworthy Machine Learning; Adversarial Robustness; Training Objective; Sample Density"	"Previous work shows that adversarially robust generalization requires larger sample complexity, and the same dataset, e.g., CIFAR-10, which enables good standard accuracy may not suffice to train robust models. Since collecting new training data could be costly, we focus on better utilizing the given data by inducing the regions with high sample density in the feature space, which could lead to locally sufficient samples for robust learning. We first formally show that the softmax cross-entropy (SCE) loss and its variants convey inappropriate supervisory signals, which encourage the learned feature points to spread over the space sparsely in training. This inspires us to propose the Max-Mahalanobis center (MMC) loss to explicitly induce dense feature regions in order to benefit robustness. Namely, the MMC loss encourages the model to concentrate on learning ordered and compact representations, which gather around the preset optimal centers for different classes. We empirically demonstrate that applying the MMC loss can significantly improve robustness even under strong adaptive attacks, while keeping state-of-the-art accuracy on clean inputs with little extra computation compared to the SCE loss."
"https://openreview.net/pdf?id=H1lZJpVFvr"	"poster"	"Robust Local Features for Improving the Generalization of Adversarial Training"	"Chuanbiao Song, Kun He, Jiadong Lin, Liwei Wang, John E. Hopcroft"	"adversarial robustness; adversarial training; adversarial example; deep learning"	"Adversarial training has been demonstrated as one of the most effective methods for training robust models to defend against adversarial examples. However, adversarially trained models often lack adversarially robust generalization on unseen testing data. Recent works show that adversarially trained models are more biased towards global structure features. Instead, in this work, we would like to investigate the relationship between the generalization of adversarial training and the robust local features, as the robust local features generalize well for unseen shape variation. To learn the robust local features, we develop a Random Block Shuffle (RBS) transformation to break up the global structure features on normal adversarial examples. We continue to propose a new approach called Robust Local Features for Adversarial Training (RLFAT), which first learns the robust local features by adversarial training on the RBS-transformed adversarial examples, and then transfers the robust local features into the training of normal adversarial examples. To demonstrate the generality of our argument, we implement RLFAT in currently state-of-the-art adversarial training frameworks. Extensive experiments on STL-10, CIFAR-10 and CIFAR-100 show that RLFAT significantly improves both the adversarially robust generalization and the standard generalization of adversarial training. Additionally, we demonstrate that our models capture more local features of the object on the images, aligning better with human perception."
