"PDF"	"Accepted as"	"Title"	"Authors"	"Keywords"	"Abstract"
"https://openreview.net/pdf?id=B1guLAVFDB"	"poster"	"Span Recovery for Deep Neural Networks with Applications to Input Obfuscation"	"Rajesh Jayaram, David P. Woodruff, Qiuyi Zhang"	"Span recovery; low rank neural networks; adversarial attack"	"The tremendous success of deep neural networks has motivated the need to better understand the fundamental properties of these networks, but many of the theoretical results proposed have only been for shallow networks. In this paper, we study an important primitive for understanding the meaningful input space of a deep network: span recovery. For k < n , let A ∈ R k × n be the innermost weight matrix of an arbitrary feed forward neural network M : R n → R , so M ( x ) can be written as M ( x ) = σ ( A x ) , for some network σ : R k → R . The goal is then to recover the row span of A given only oracle access to the value of M ( x ) . We show that if M is a multi-layered network with ReLU activation functions, then partial recovery is possible: namely, we can provably recover k / 2 linearly independent vectors in the row span of A using poly ( n ) non-adaptive queries to M ( x ) . Furthermore, if M has differentiable activation functions, we demonstrate that \textit{full} span recovery is possible even when the output is first passed through a sign or 0 / 1 thresholding function; in this case our algorithm is adaptive. Empirically, we confirm that full span recovery is not always possible, but only for unrealistically thin layers. For reasonably wide networks, we obtain full span recovery on both random networks and networks trained on MNIST data. Furthermore, we demonstrate the utility of span recovery as an attack by inducing neural networks to misclassify data obfuscated by controlled random noise as sensical inputs."
"https://openreview.net/pdf?id=r1lF_CEYwS"	"poster"	"On the Need for Topology-Aware Generative Models for Manifold-Based Defenses"	"Uyeong Jang, Susmit Jha, Somesh Jha"	"Manifold-based Defense; Robust Learning; Adversarial Attacks"	"ML algorithms or models, especially deep neural networks (DNNs), have shown significant promise in several areas. However, recently researchers have demonstrated that ML algorithms, especially DNNs, are vulnerable to adversarial examples (slightly perturbed samples that cause mis-classification). Existence of adversarial examples has hindered deployment of ML algorithms in safety-critical sectors, such as security. Several defenses for adversarial examples exist in the literature. One of the important classes of defenses are manifold-based defenses, where a sample is ""pulled back"" into the data manifold before classifying. These defenses rely on the manifold assumption (data lie in a manifold of lower dimension than the input space). These defenses use a generative model to approximate the input distribution. This paper asks the following question: do the generative models used in manifold-based defenses need to be topology-aware? Our paper suggests the answer is yes. We provide theoretical and empirical evidence to support our claim."
"https://openreview.net/pdf?id=HyxJhCEFDS"	"poster"	"Intriguing Properties of Adversarial Training at Scale"	"Cihang Xie, Alan Yuille"	"adversarial defense; adversarial machine learning"	"Adversarial training is one of the main defenses against adversarial attacks. In this paper, we provide the first rigorous study on diagnosing elements of large-scale adversarial training on ImageNet, which reveals two intriguing properties.  First, we study the role of normalization. Batch normalization (BN) is a crucial element for achieving state-of-the-art performance on many vision tasks, but we show it may prevent networks from obtaining strong robustness in adversarial training. One unexpected observation is that, for models trained with BN, simply removing clean images from training data largely boosts adversarial robustness, i.e., 18.3%. We relate this phenomenon to the hypothesis that clean images and adversarial images are drawn from two different domains. This two-domain hypothesis may explain the issue of BN when training with a mixture of clean and adversarial images, as estimating normalization statistics of this mixture distribution is challenging. Guided by this two-domain hypothesis, we show disentangling the mixture distribution for normalization, i.e., applying separate BNs to clean and adversarial images for statistics estimation, achieves much stronger robustness. Additionally, we find that enforcing BNs to behave consistently at training and testing can further enhance robustness.  Second, we study the role of network capacity. We find our so-called ""deep"" networks are still shallow for the task of adversarial learning. Unlike traditional classification tasks where accuracy is only marginally improved by adding more layers to ""deep"" networks (e.g., ResNet-152), adversarial training exhibits a much stronger demand on deeper networks to achieve higher adversarial robustness. This robustness improvement can be observed substantially and consistently even by pushing the network capacity to an unprecedented scale, i.e., ResNet-638."
"https://openreview.net/pdf?id=r1xGnA4Kvr"	"poster"	"Biologically inspired sleep algorithm for increased generalization and adversarial robustness in deep neural networks"	"Timothy Tadros, Giri Krishnan, Ramyaa Ramyaa, Maxim Bazhenov"	"Adversarial Robustness; Generalization; Neural Computing; Deep Learning"	"Current artificial neural networks (ANNs) can perform and excel at a variety of tasks ranging from image classification to spam detection through training on large datasets of labeled data. While the trained network may perform well on similar testing data, inputs that differ even slightly from the training data may trigger unpredictable behavior. Due to this limitation, it is possible to design inputs with very small perturbations that can result in misclassification. These adversarial attacks present a security risk to deployed ANNs and indicate a divergence between how ANNs and humans perform classification. Humans are robust at behaving in the presence of noise and are capable of correctly classifying objects that are noisy, blurred, or otherwise distorted. It has been hypothesized that sleep promotes generalization of knowledge and improves robustness against noise in animals and humans. In this work, we utilize a biologically inspired sleep phase in ANNs and demonstrate the benefit of sleep on defending against adversarial attacks as well as in increasing ANN classification robustness. We compare the sleep algorithm's performance on various robustness tasks with two previously proposed adversarial defenses - defensive distillation and fine-tuning. We report an increase in robustness after sleep phase to adversarial attacks as well as to general image distortions for three datasets: MNIST, CUB200, and a toy dataset. Overall, these results demonstrate the potential for biologically inspired solutions to solve existing problems in ANNs and guide the development of more robust, human-like ANNs."
"https://openreview.net/pdf?id=Skxuk1rFwB"	"poster"	"Towards Stable and Efficient Training of Verifiably Robust Neural Networks"	"Huan Zhang, Hongge Chen, Chaowei Xiao, Sven Gowal, Robert Stanforth, Bo Li, Duane Boning, Cho-Jui Hsieh"	"Robust Neural Networks; Verifiable Training; Certified Adversarial Defense"	"Training neural networks with verifiable robustness guarantees is challenging. Several existing approaches utilize linear relaxation based neural network output bounds under perturbation, but they can slow down training by a factor of hundreds depending on the underlying network architectures. Meanwhile, interval bound propagation (IBP) based training is efficient and significantly outperforms linear relaxation based methods on many tasks, yet it may suffer from stability issues since the bounds are much looser especially at the beginning of training. In this paper, we propose a new certified adversarial training method, CROWN-IBP, by combining the fast IBP bounds in a forward bounding pass and a tight linear relaxation based bound, CROWN, in a backward bounding pass. CROWN-IBP is computationally efficient and consistently outperforms IBP baselines on training verifiably robust neural networks. We conduct large scale experiments on MNIST and CIFAR datasets, and outperform all previous linear relaxation and bound propagation based certified defenses in L_inf robustness. Notably, we achieve 7.02% verified test error on MNIST at epsilon=0.3, and 66.94% on CIFAR-10 with epsilon=8/255."
"https://openreview.net/pdf?id=rJgzzJHtDB"	"poster"	"Triple Wins: Boosting Accuracy, Robustness and Efficiency Together by Enabling Input-Adaptive Inference"	"Ting-Kuei Hu, Tianlong Chen, Haotao Wang, Zhangyang Wang"	"adversarial robustness; efficient inference"	"Deep networks were recently suggested to face the odds between accuracy (on clean natural images) and robustness (on adversarially perturbed images) (Tsipras et al., 2019). Such a dilemma is shown to be rooted in the inherently higher sample complexity (Schmidt et al., 2018) and/or model capacity (Nakkiran, 2019), for learning a high-accuracy and robust classifier. In view of that, give a classification task, growing the model capacity appears to help draw a win-win between accuracy and robustness, yet at the expense of model size and latency, therefore posing challenges for resource-constrained applications. Is it possible to co-design model accuracy, robustness and efficiency to achieve their triple wins? This paper studies multi-exit networks associated with input-adaptive efficient inference, showing their strong promise in achieving a “sweet point"" in co-optimizing model accuracy, robustness, and efficiency. Our proposed solution, dubbed Robust Dynamic Inference Networks (RDI-Nets), allows for each input (either clean or adversarial) to adaptively choose one of the multiple output layers (early branches or the final one) to output its prediction. That multi-loss adaptivity adds new variations and flexibility to adversarial attacks and defenses, on which we present a systematical investigation. We show experimentally that by equipping existing backbones with such robust adaptive inference, the resulting RDI-Nets can achieve better accuracy and robustness, yet with over 30% computational savings, compared to the defended original models."
"https://openreview.net/pdf?id=Hke0V1rKPS"	"poster"	"Jacobian Adversarially Regularized Networks for Robustness"	"Alvin Chan, Yi Tay, Yew Soon Ong, Jie Fu"	"adversarial examples; robust machine learning; deep learning"	"Adversarial examples are crafted with imperceptible perturbations with the intent to fool neural networks. Against such attacks, adversarial training and its variants stand as the strongest defense to date. Previous studies have pointed out that robust models that have undergone adversarial training tend to produce more salient and interpretable Jacobian matrices than their non-robust counterparts. A natural question is whether a model trained with an objective to produce salient Jacobian can result in better robustness. This paper answers this question with affirmative empirical results. We propose Jacobian Adversarially Regularized Networks (JARN) as a method to optimize the saliency of a classifier's Jacobian by adversarially regularizing the model's Jacobian to resemble natural training images. Image classifiers trained with JARN show improved robust accuracy compared to standard models on the MNIST, SVHN and CIFAR-10 datasets, uncovering a new angle to boost robustness without using adversarial training."
"https://openreview.net/pdf?id=HyeaSkrYPH"	"poster"	"Certified Defenses for Adversarial Patches"	"Ping-yeh Chiang*, Renkun Ni*, Ahmed Abdelkader, Chen Zhu, Christoph Studor, Tom Goldstein"	"certified defenses; patch attack; adversarial robustness; sparse defense"	"Adversarial patch attacks are among one of the most practical threat models against real-world computer vision systems. This paper studies certified and empirical defenses against patch attacks. We begin with a set of experiments showing that most existing defenses, which work by pre-processing input images to mitigate adversarial patches, are easily broken by simple white-box adversaries. Motivated by this finding, we propose the first certified defense against patch attacks, and propose faster methods for its training. Furthermore, we experiment with different patch shapes for testing, obtaining surprisingly good robustness transfer across shapes, and present preliminary results on certified defense against sparse attacks. Our complete implementation can be found on: https://github.com/Ping-C/certifiedpatchdefense."
"https://openreview.net/pdf?id=B1gX8kBtPr"	"poster"	"Universal Approximation with Certified Networks"	"Maximilian Baader, Matthew Mirman, Martin Vechev"	"adversarial robustness; universal approximation; certified network; interval bound propagation"	"Training neural networks to be certifiably robust is critical to ensure their safety against adversarial attacks. However, it is currently very difficult to train a neural network that is both accurate and certifiably robust. In this work we take a step towards addressing this challenge. We prove that for every continuous function f , there exists a network n such that: (i) n approximates f arbitrarily close, and (ii) simple interval bound propagation of a region B through n yields a result that is arbitrarily close to the optimal output of f on B . Our result can be seen as a Universal Approximation Theorem for interval-certified ReLU networks. To the best of our knowledge, this is the first work to prove the existence of accurate, interval-certified networks."
"https://openreview.net/pdf?id=SJlHwkBYDH"	"poster"	"Nesterov Accelerated Gradient and Scale Invariance for Adversarial Attacks"	"Jiadong Lin, Chuanbiao Song, Kun He, Liwei Wang, John E. Hopcroft"	"adversarial examples; adversarial attack; transferability; Nesterov accelerated gradient; scale invariance"	"Deep learning models are vulnerable to adversarial examples crafted by applying human-imperceptible perturbations on benign inputs. However, under the black-box setting, most existing adversaries often have a poor transferability to attack other defense models. In this work, from the perspective of regarding the adversarial example generation as an optimization process, we propose two new methods to improve the transferability of adversarial examples, namely Nesterov Iterative Fast Gradient Sign Method (NI-FGSM) and Scale-Invariant attack Method (SIM). NI-FGSM aims to adapt Nesterov accelerated gradient into the iterative attacks so as to effectively look ahead and improve the transferability of adversarial examples. While SIM is based on our discovery on the scale-invariant property of deep learning models, for which we leverage to optimize the adversarial perturbations over the scale copies of the input images so as to avoid ""overfitting” on the white-box model being attacked and generate more transferable adversarial examples. NI-FGSM and SIM can be naturally integrated to build a robust gradient-based attack to generate more transferable adversarial examples against the defense models. Empirical results on ImageNet dataset demonstrate that our attack methods exhibit higher transferability and achieve higher attack success rates than state-of-the-art gradient-based attacks."
"https://openreview.net/pdf?id=rklk_ySYPB"	"poster"	"Provable robustness against all adversarial l p -perturbations for p ≥ 1"	"Francesco Croce, Matthias Hein"	"adversarial robustness; provable guarantees"	"In recent years several adversarial attacks and defenses have been proposed. Often seemingly robust models turn out to be non-robust when more sophisticated attacks are used. One way out of this dilemma are provable robustness guarantees. While provably robust models for specific l p -perturbation models have been developed, we show that they do not come with any guarantee against other l q -perturbations. We propose a new regularization scheme, MMR-Universal, for ReLU networks which enforces robustness wrt l 1 - \textit{and} l ∞ -perturbations and show how that leads to the first provably robust models wrt any l p -norm for p ≥ 1 ."
"https://openreview.net/pdf?id=HJem3yHKwH"	"poster"	"EMPIR: Ensembles of Mixed Precision Deep Networks for Increased Robustness Against Adversarial Attacks"	"Sanchari Sen, Balaraman Ravindran, Anand Raghunathan"	"ensembles; mixed precision; robustness; adversarial attacks"	"Ensuring robustness of Deep Neural Networks (DNNs) is crucial to their adoption in safety-critical applications such as self-driving cars, drones, and healthcare. Notably, DNNs are vulnerable to adversarial attacks in which small input perturbations can produce catastrophic misclassifications. In this work, we propose EMPIR, ensembles of quantized DNN models with different numerical precisions, as a new approach to increase robustness against adversarial attacks. EMPIR is based on the observation that quantized neural networks often demonstrate much higher robustness to adversarial attacks than full precision networks, but at the cost of a substantial loss in accuracy on the original (unperturbed) inputs. EMPIR overcomes this limitation to achieve the ``best of both worlds"", i.e., the higher unperturbed accuracies of the full precision models combined with the higher robustness of the low precision models, by composing them in an ensemble. Further, as low precision DNN models have significantly lower computational and storage requirements than full precision models, EMPIR models only incur modest compute and memory overheads compared to a single full-precision model (<25% in our evaluations). We evaluate EMPIR across a suite of DNNs for 3 different image recognition tasks (MNIST, CIFAR-10 and ImageNet) and under 4 different adversarial attacks. Our results indicate that EMPIR boosts the average adversarial accuracies by 42.6%, 15.2% and 10.5% for the DNN models trained on the MNIST, CIFAR-10 and ImageNet datasets respectively, when compared to single full-precision models, without sacrificing accuracy on the unperturbed inputs."
"https://openreview.net/pdf?id=SylL0krYPS"	"poster"	"Toward Evaluating Robustness of Deep Reinforcement Learning with Continuous Control"	"Tsui-Wei Weng, Krishnamurthy (Dj) Dvijotham*, Jonathan Uesato*, Kai Xiao*, Sven Gowal*, Robert Stanforth*, Pushmeet Kohli"	"deep learning; reinforcement learning; robustness; adversarial examples"	"Deep reinforcement learning has achieved great success in many previously difficult reinforcement learning tasks, yet recent studies show that deep RL agents are also unavoidably susceptible to adversarial perturbations, similar to deep neural networks in classification tasks. Prior works mostly focus on model-free adversarial attacks and agents with discrete actions. In this work, we study the problem of continuous control agents in deep RL with adversarial attacks and propose the first two-step algorithm based on learned model dynamics. Extensive experiments on various MuJoCo domains (Cartpole, Fish, Walker, Humanoid) demonstrate that our proposed framework is much more effective and efficient than model-free based attacks baselines in degrading agent performance as well as driving agents to unsafe states."
"https://openreview.net/pdf?id=HkeryxBtPB"	"poster"	"MMA Training: Direct Input Space Margin Maximization through Adversarial Training"	"Gavin Weiguang Ding, Yash Sharma, Kry Yik Chau Lui, Ruitong Huang"	"adversarial robustness; perturbation; margin maximization; deep learning"	"We study adversarial robustness of neural networks from a margin maximization perspective, where margins are defined as the distances from inputs to a classifier's decision boundary. Our study shows that maximizing margins can be achieved by minimizing the adversarial loss on the decision boundary at the ""shortest successful perturbation"", demonstrating a close connection between adversarial losses and the margins. We propose Max-Margin Adversarial (MMA) training to directly maximize the margins to achieve adversarial robustness. Instead of adversarial training with a fixed ϵ , MMA offers an improvement by enabling adaptive selection of the ""correct"" ϵ as the margin individually for each datapoint. In addition, we rigorously analyze adversarial training with the perspective of margin maximization, and provide an alternative interpretation for adversarial training, maximizing either a lower or an upper bound of the margins. Our experiments empirically confirm our theory and demonstrate MMA training's efficacy on the MNIST and CIFAR10 datasets w.r.t. ℓ ∞ and ℓ 2 robustness."
"https://openreview.net/pdf?id=r1lPleBFvH"	"poster"	"Understanding the Limitations of Conditional Generative Models"	"Ethan Fetaya, Joern-Henrik Jacobsen, Will Grathwohl, Richard Zemel"	"Conditional Generative Models; Generative Classifiers; Robustness; Adversarial Examples"	"Class-conditional generative models hold promise to overcome the shortcomings of their discriminative counterparts. They are a natural choice to solve discriminative tasks in a robust manner as they jointly optimize for predictive performance and accurate modeling of the input distribution. In this work, we investigate robust classification with likelihood-based generative models from a theoretical and practical perspective to investigate if they can deliver on their promises. Our analysis focuses on a spectrum of robustness properties: (1) Detection of worst-case outliers in the form of adversarial examples; (2) Detection of average-case outliers in the form of ambiguous inputs and (3) Detection of incorrectly labeled in-distribution inputs.  Our theoretical result reveals that it is impossible to guarantee detectability of adversarially-perturbed inputs even for near-optimal generative classifiers. Experimentally, we find that while we are able to train robust models for MNIST, robustness completely breaks down on CIFAR10. We relate this failure to various undesirable model properties that can be traced to the maximum likelihood training objective. Despite being a common choice in the literature, our results indicate that likelihood-based conditional generative models may are surprisingly ineffective for robust classification."
"https://openreview.net/pdf?id=Hkem-lrtvH"	"poster"	"BayesOpt Adversarial Attack"	"Binxin Ru, Adam Cobb, Arno Blaas, Yarin Gal"	"Black-box Adversarial Attack; Bayesian Optimisation; Gaussian Process"	"Black-box adversarial attacks require a large number of attempts before finding successful adversarial examples that are visually indistinguishable from the original input. Current approaches relying on substitute model training, gradient estimation or genetic algorithms often require an excessive number of queries. Therefore, they are not suitable for real-world systems where the maximum query number is limited due to cost. We propose a query-efficient black-box attack which uses Bayesian optimisation in combination with Bayesian model selection to optimise over the adversarial perturbation and the optimal degree of search space dimension reduction. We demonstrate empirically that our method can achieve comparable success rates with 2-5 times fewer queries compared to previous state-of-the-art black-box attacks."
"https://openreview.net/pdf?id=Sye_OgHFwH"	"poster"	"Unrestricted Adversarial Examples via Semantic Manipulation"	"Anand Bhattad, Min Jin Chong, Kaizhao Liang, Bo Li, D. A. Forsyth"	"Adversarial Examples; Semantic Manipulation; Image Colorization; Texture Transfer"	"Machine learning models, especially deep neural networks (DNNs), have been shown to be vulnerable against adversarial examples which are carefully crafted samples with a small magnitude of the perturbation. Such adversarial perturbations are usually restricted by bounding their L p norm such that they are imperceptible, and thus many current defenses can exploit this property to reduce their adversarial impact. In this paper, we instead introduce ""unrestricted"" perturbations that manipulate semantically meaningful image-based visual descriptors - color and texture - in order to generate effective and photorealistic adversarial examples. We show that these semantically aware perturbations are effective against JPEG compression, feature squeezing and adversarially trained model. We also show that the proposed methods can effectively be applied to both image classification and image captioning tasks on complex datasets such as ImageNet and MSCOCO. In addition, we conduct comprehensive user studies to show that our generated semantic adversarial examples are photorealistic to humans despite large magnitude perturbations when compared to other attacks."
"https://openreview.net/pdf?id=HJxdTxHYvB"	"poster"	"BREAKING CERTIFIED DEFENSES: SEMANTIC ADVERSARIAL EXAMPLES WITH SPOOFED ROBUSTNESS CERTIFICATES"	"Amin Ghiasi, Ali Shafahi, Tom Goldstein"	"--"	"Defenses against adversarial attacks can be classified into certified and non-certified. Certifiable defenses make networks robust within a certain ℓ p -bounded radius, so that it is impossible for the adversary to make adversarial examples in the certificate bound. We present an attack that maintains the imperceptibility property of adversarial examples while being outside of the certified radius. Furthermore, the proposed ""Shadow Attack"" can fool certifiably robust networks by producing an imperceptible adversarial example that gets misclassified and produces a strong ``spoofed'' certificate."
