"PDF"	"Accepted as"	"Title"	"Authors"	"Keywords"	"Abstract"
"https://openreview.net/pdf?id=rJl31TNYPr"	"poster"	"Fooling Detection Alone is Not Enough: Adversarial Attack against Multiple Object Tracking"	"Yunhan Jia, Yantao Lu, Junjie Shen, Qi Alfred Chen, Hao Chen, Zhenyu Zhong, Tao Wei"	"Adversarial examples; object detection; object tracking; security; autonomous vehicle; deep learning"	"Recent work in adversarial machine learning started to focus on the visual perception in autonomous driving and studied Adversarial Examples (AEs) for object detection models. However, in such visual perception pipeline the detected objects must also be tracked, in a process called Multiple Object Tracking (MOT), to build the moving trajectories of surrounding obstacles. Since MOT is designed to be robust against errors in object detection, it poses a general challenge to existing attack techniques that blindly target objection detection: we find that a success rate of over 98% is needed for them to actually affect the tracking results, a requirement that no existing attack technique can satisfy. In this paper, we are the first to study adversarial machine learning attacks against the complete visual perception pipeline in autonomous driving, and discover a novel attack technique, tracker hijacking, that can effectively fool MOT using AEs on object detection. Using our technique, successful AEs on as few as one single frame can move an existing object in to or out of the headway of an autonomous vehicle to cause potential safety hazards. We perform evaluation using the Berkeley Deep Drive dataset and find that on average when 3 frames are attacked, our attack can have a nearly 100% success rate while attacks that blindly target object detection only have up to 25%."
"https://openreview.net/pdf?id=rklOg6EFwS"	"poster"	"Improving Adversarial Robustness Requires Revisiting Misclassified Examples"	"Yisen Wang, Difan Zou, Jinfeng Yi, James Bailey, Xingjun Ma, Quanquan Gu"	"Robustness; Adversarial Defense; Adversarial Training"	"Deep neural networks (DNNs) are vulnerable to adversarial examples crafted by imperceptible perturbations. A range of defense techniques have been proposed to improve DNN robustness to adversarial examples, among which adversarial training has been demonstrated to be the most effective. Adversarial training is often formulated as a min-max optimization problem, with the inner maximization for generating adversarial examples. However, there exists a simple, yet easily overlooked fact that adversarial examples are only defined on correctly classified (natural) examples, but inevitably, some (natural) examples will be misclassified during training. In this paper, we investigate the distinctive influence of misclassified and correctly classified examples on the final robustness of adversarial training. Specifically, we find that misclassified examples indeed have a significant impact on the final robustness. More surprisingly, we find that different maximization techniques on misclassified examples may have a negligible influence on the final robustness, while different minimization techniques are crucial. Motivated by the above discovery, we propose a new defense algorithm called {\em Misclassification Aware adveRsarial Training} (MART), which explicitly differentiates the misclassified and correctly classified examples during the training. We also propose a semi-supervised extension of MART, which can leverage the unlabeled data to further improve the robustness. Experimental results show that MART and its variant could significantly improve the state-of-the-art adversarial robustness."
"https://openreview.net/pdf?id=HJgEMpVFwB"	"poster"	"Adversarial Policies: Attacking Deep Reinforcement Learning"	"Adam Gleave, Michael Dennis, Cody Wild, Neel Kant, Sergey Levine, Stuart Russell"	"deep RL; adversarial examples; security; multi-agent"	"Deep reinforcement learning (RL) policies are known to be vulnerable to adversarial perturbations to their observations, similar to adversarial examples for classifiers. However, an attacker is not usually able to directly modify another agent's observations. This might lead one to wonder: is it possible to attack an RL agent simply by choosing an adversarial policy acting in a multi-agent environment so as to create natural observations that are adversarial? We demonstrate the existence of adversarial policies in zero-sum games between simulated humanoid robots with proprioceptive observations, against state-of-the-art victims trained via self-play to be robust to opponents. The adversarial policies reliably win against the victims but generate seemingly random and uncoordinated behavior. We find that these policies are more successful in high-dimensional environments, and induce substantially different activations in the victim policy network than when the victim plays against a normal opponent. Videos are available at https://adversarialpolicies.github.io/."
"https://openreview.net/pdf?id=rJx1Na4Fwr"	"poster"	"MACER: Attack-free and Scalable Robust Training via Maximizing Certified Radius"	"Runtian Zhai, Chen Dan, Di He, Huan Zhang, Boqing Gong, Pradeep Ravikumar, Cho-Jui Hsieh, Liwei Wang"	"Adversarial Robustness; Provable Adversarial Defense; Randomized Smoothing; Robustness Certification"	"Adversarial training is one of the most popular ways to learn robust models but is usually attack-dependent and time costly. In this paper, we propose the MACER algorithm, which learns robust models without using adversarial training but performs better than all existing provable l2-defenses. Recent work shows that randomized smoothing can be used to provide a certified l2 radius to smoothed classifiers, and our algorithm trains provably robust smoothed classifiers via MAximizing the CErtified Radius (MACER). The attack-free characteristic makes MACER faster to train and easier to optimize. In our experiments, we show that our method can be applied to modern deep neural networks on a wide range of datasets, including Cifar-10, ImageNet, MNIST, and SVHN. For all tasks, MACER spends less training time than state-of-the-art adversarial training algorithms, and the learned models achieve larger average certified radius."
"https://openreview.net/pdf?id=Skgy464Kvr"	"poster"	"Detecting and Diagnosing Adversarial Images with Class-Conditional Capsule Reconstructions"	"Yao Qin, Nicholas Frosst, Sara Sabour, Colin Raffel, Garrison Cottrell, Geoffrey Hinton"	"Adversarial Examples; Detection of adversarial attacks"	"Adversarial examples raise questions about whether neural network models are sensitive to the same visual features as humans. In this paper, we first detect adversarial examples or otherwise corrupted images based on a class-conditional reconstruction of the input. To specifically attack our detection mechanism, we propose the Reconstructive Attack which seeks both to cause a misclassification and a low reconstruction error. This reconstructive attack produces undetected adversarial examples but with much smaller success rate. Among all these attacks, we find that CapsNets always perform better than convolutional networks. Then, we diagnose the adversarial examples for CapsNets and find that the success of the reconstructive attack is highly related to the visual similarity between the source and target class. Additionally, the resulting perturbations can cause the input image to appear visually more like the target class and hence become non-adversarial. This suggests that CapsNets use features that are more aligned with human perception and have the potential to address the central issue raised by adversarial examples."
"https://openreview.net/pdf?id=SJeQEp4YDH"	"poster"	"GAT: Generative Adversarial Training for Adversarial Example Detection and Robust Classification"	"Xuwang Yin, Soheil Kolouri, Gustavo K Rohde"	"adversarial example detection; adversarial examples classification; robust optimization; ML security; generative modeling; generative classification"	"The vulnerabilities of deep neural networks against adversarial examples have become a significant concern for deploying these models in sensitive domains. Devising a definitive defense against such attacks is proven to be challenging, and the methods relying on detecting adversarial samples are only valid when the attacker is oblivious to the detection mechanism. In this paper we present an adversarial example detection method that provides performance guarantee to norm constrained adversaries. The method is based on the idea of training adversarial robust subspace detectors using generative adversarial training (GAT). The novel GAT objective presents a saddle point problem similar to that of GANs; it has the same convergence property, and consequently supports the learning of class conditional distributions. We demonstrate that the saddle point problem could be reasonably solved by PGD attack, and further use the learned class conditional generative models to define generative detection/classification models that are both robust and more interpretable. We provide comprehensive evaluations of the above methods, and demonstrate their competitive performances and compelling properties on adversarial detection and robust classification problems."
"https://openreview.net/pdf?id=SJxhNTNYwB"	"poster"	"Black-Box Adversarial Attack with Transferable Model-based Embedding"	"Zhichao Huang, Tong Zhang"	"adversarial examples; black-box attack; embedding"	"We present a new method for black-box adversarial attack. Unlike previous methods that combined transfer-based and scored-based methods by using the gradient or initialization of a surrogate white-box model, this new method tries to learn a low-dimensional embedding using a pretrained model, and then performs efficient search within the embedding space to attack an unknown target network. The method produces adversarial perturbations with high level semantic patterns that are easily transferable. We show that this approach can greatly improve the query efficiency of black-box adversarial attack across different target network architectures. We evaluate our approach on MNIST, ImageNet and Google Cloud Vision API, resulting in a significant reduction on the number of queries. We also attack adversarially defended networks on CIFAR10 and ImageNet, where our method not only reduces the number of queries, but also improves the attack success rate."
"https://openreview.net/pdf?id=BkeWw6VFwr"	"poster"	"Certified Robustness for Top-k Predictions against Adversarial Perturbations via Randomized Smoothing"	"Jinyuan Jia, Xiaoyu Cao, Binghui Wang, Neil Zhenqiang Gong"	"Certified Adversarial Robustness; Randomized Smoothing; Adversarial Examples"	"It is well-known that classifiers are vulnerable to adversarial perturbations. To defend against adversarial perturbations, various certified robustness results have been derived. However, existing certified robustnesses are limited to top-1 predictions. In many real-world applications, top- k predictions are more relevant. In this work, we aim to derive certified robustness for top- k predictions. In particular, our certified robustness is based on randomized smoothing, which turns any classifier to a new classifier via adding noise to an input example. We adopt randomized smoothing because it is scalable to large-scale neural networks and applicable to any classifier. We derive a tight robustness in ℓ 2 norm for top- k predictions when using randomized smoothing with Gaussian noise. We find that generalizing the certified robustness from top-1 to top- k predictions faces significant technical challenges. We also empirically evaluate our method on CIFAR10 and ImageNet. For example, our method can obtain an ImageNet classifier with a certified top-5 accuracy of 62.8\% when the ℓ 2 -norms of the adversarial perturbations are less than 0.5 (=127/255). Our code is publicly available at: \url{https://github.com/jjy1994/Certify_Topk}."
"https://openreview.net/pdf?id=H1gfFaEYDS"	"poster"	"Adversarially Robust Representations with Smooth Encoders"	"Taylan Cemgil, Sumedh Ghaisas, Krishnamurthy (Dj) Dvijotham, Pushmeet Kohli"	"Adversarial Learning; Robust Representations; Variational AutoEncoder; Wasserstein Distance; Variational Inference"	"This paper studies the undesired phenomena of over-sensitivity of representations learned by deep networks to semantically-irrelevant changes in data. We identify a cause for this shortcoming in the classical Variational Auto-encoder (VAE) objective, the evidence lower bound (ELBO). We show that the ELBO fails to control the behaviour of the encoder out of the support of the empirical data distribution and this behaviour of the VAE can lead to extreme errors in the learned representation. This is a key hurdle in the effective use of representations for data-efficient learning and transfer. To address this problem, we propose to augment the data with specifications that enforce insensitivity of the representation with respect to families of transformations. To incorporate these specifications, we propose a regularization method that is based on a selection mechanism that creates a fictive data point by explicitly perturbing an observed true data point. For certain choices of parameters, our formulation naturally leads to the minimization of the entropy regularized Wasserstein distance between representations. We illustrate our approach on standard datasets and experimentally show that significant improvements in the downstream adversarial accuracy can be achieved by learning robust representations completely in an unsupervised manner, without a reference to a particular downstream task and without a costly supervised adversarial training procedure."
"https://openreview.net/pdf?id=SJg7spEYDS"	"poster"	"Generative Ratio Matching Networks"	"Akash Srivastava, Kai Xu, Michael U. Gutmann, Charles Sutton"	"deep generative model; deep learning; maximum mean discrepancy; density ratio estimation"	"Deep generative models can learn to generate realistic-looking images, but many of the most effective methods are adversarial and involve a saddlepoint optimization, which requires a careful balancing of training between a generator network and a critic network. Maximum mean discrepancy networks (MMD-nets) avoid this issue by using kernel as a fixed adversary, but unfortunately, they have not on their own been able to match the generative quality of adversarial training. In this work, we take their insight of using kernels as fixed adversaries further and present a novel method for training deep generative models that does not involve saddlepoint optimization. We call our method generative ratio matching or GRAM for short. In GRAM, the generator and the critic networks do not play a zero-sum game against each other, instead, they do so against a fixed kernel. Thus GRAM networks are not only stable to train like MMD-nets but they also match and beat the generative quality of adversarially trained generative networks."
"https://openreview.net/pdf?id=SygW0TEFwH"	"poster"	"Sign Bits Are All You Need for Black-Box Attacks"	"Abdullah Al-Dujaili, Una-May O'Reilly"	"Black-box adversarial attack models; Deep Nets; Adversarial Examples; Black-Box Optimization; Zeroth-Order Optimization"	"We present a novel black-box adversarial attack algorithm with state-of-the-art model evasion rates for query efficiency under ℓ ∞ and ℓ 2 metrics. It exploits a \textit{sign-based}, rather than magnitude-based, gradient estimation approach that shifts the gradient estimation from continuous to binary black-box optimization. It adaptively constructs queries to estimate the gradient, one query relying upon the previous, rather than re-estimating the gradient each step with random query construction. Its reliance on sign bits yields a smaller memory footprint and it requires neither hyperparameter tuning or dimensionality reduction. Further, its theoretical performance is guaranteed and it can characterize adversarial subspaces better than white-box gradient-aligned subspaces. On two public black-box attack challenges and a model robustly trained against transfer attacks, the algorithm's evasion rates surpass all submitted attacks. For a suite of published models, the algorithm is 3.8 × less failure-prone while spending 2.5 × fewer queries versus the best combination of state of art algorithms. For example, it evades a standard MNIST model using just 12 queries on average. Similar performance is observed on a standard IMAGENET model with an average of 579 queries."
"https://openreview.net/pdf?id=HkgrZ0EYwB"	"poster"	"Unpaired Point Cloud Completion on Real Scans using Adversarial Training"	"Xuelin Chen, Baoquan Chen, Niloy J. Mitra"	"point cloud completion; generative adversarial network; real scans"	"As 3D scanning solutions become increasingly popular, several deep learning setups have been developed for the task of scan completion, i.e., plausibly filling in regions that were missed in the raw scans. These methods, however, largely rely on supervision in the form of paired training data, i.e., partial scans with corresponding desired completed scans. While these methods have been successfully demonstrated on synthetic data, the approaches cannot be directly used on real scans in absence of suitable paired training data. We develop a first approach that works directly on input point clouds, does not require paired training data, and hence can directly be applied to real scans for scan completion. We evaluate the approach qualitatively on several real-world datasets (ScanNet, Matterport3D, KITTI), quantitatively on 3D-EPN shape completion benchmark dataset, and demonstrate realistic completions under varying levels of incompleteness."
"https://openreview.net/pdf?id=ryebG04YvB"	"poster"	"Adversarially robust transfer learning"	"Ali Shafahi, Parsa Saadatpanah, Chen Zhu, Amin Ghiasi, Christoph Studer, David Jacobs, Tom Goldstein"	"--"	"Transfer learning, in which a network is trained on one task and re-purposed on another, is often used to produce neural network classifiers when data is scarce or full-scale training is too costly. When the goal is to produce a model that is not only accurate but also adversarially robust, data scarcity and computational limitations become even more cumbersome. We consider robust transfer learning, in which we transfer not only performance but also robustness from a source model to a target domain. We start by observing that robust networks contain robust feature extractors. By training classifiers on top of these feature extractors, we produce new models that inherit the robustness of their parent networks. We then consider the case of ""fine tuning"" a network by re-training end-to-end in the target domain. When using lifelong learning strategies, this process preserves the robustness of the source network while achieving high accuracy. By using such strategies, it is possible to produce accurate and robust models with little data, and without the cost of adversarial training. Additionally, we can improve the generalization of adversarially trained models, while maintaining their robustness."
"https://openreview.net/pdf?id=SJgwzCEKwH"	"poster"	"Bridging Mode Connectivity in Loss Landscapes and Adversarial Robustness"	"Pu Zhao, Pin-Yu Chen, Payel Das, Karthikeyan Natesan Ramamurthy, Xue Lin"	"mode connectivity; adversarial robustness; backdoor attack; error-injection attack; evasion attacks; loss landscapes"	"Mode connectivity provides novel geometric insights on analyzing loss landscapes and enables building high-accuracy pathways between well-trained neural networks. In this work, we propose to employ mode connectivity in loss landscapes to study the adversarial robustness of deep neural networks, and provide novel methods for improving this robustness. Our experiments cover various types of adversarial attacks applied to different network architectures and datasets. When network models are tampered with backdoor or error-injection attacks, our results demonstrate that the path connection learned using limited amount of bonafide data can effectively mitigate adversarial effects while maintaining the original accuracy on clean data. Therefore, mode connectivity provides users with the power to repair backdoored or error-injected models. We also use mode connectivity to investigate the loss landscapes of regular and robust models against evasion attacks. Experiments show that there exists a barrier in adversarial robustness loss on the path connecting regular and adversarially-trained models. A high correlation is observed between the adversarial robustness loss and the largest eigenvalue of the input Hessian matrix, for which theoretical justifications are provided. Our results suggest that mode connectivity offers a holistic tool and practical means for evaluating and improving adversarial robustness."
"https://openreview.net/pdf?id=SklTQCNtvS"	"poster"	"Sign-OPT: A Query-Efficient Hard-label Adversarial Attack"	"Minhao Cheng, Simranjit Singh, Patrick H. Chen, Pin-Yu Chen, Sijia Liu, Cho-Jui Hsieh"	"--"	"We study the most practical problem setup for evaluating adversarial robustness of a machine learning system with limited access: the hard-label black-box attack setting for generating adversarial examples, where limited model queries are allowed and only the decision is provided to a queried data input. Several algorithms have been proposed for this problem but they typically require huge amount (>20,000) of queries for attacking one example. Among them, one of the state-of-the-art approaches (Cheng et al., 2019) showed that hard-label attack can be modeled as an optimization problem where the objective function can be evaluated by binary search with additional model queries, thereby a zeroth order optimization algorithm can be applied. In this paper, we adopt the same optimization formulation but propose to directly estimate the sign of gradient at any direction instead of the gradient itself, which enjoys the benefit of single query. Using this single query oracle for retrieving sign of directional derivative, we develop a novel query-efficient Sign-OPT approach for hard-label black-box attack. We provide a convergence analysis of the new algorithm and conduct experiments on several models on MNIST, CIFAR-10 and ImageNet. We find that Sign-OPT attack consistently requires 5X to 10X fewer queries when compared to the current state-of-the-art approaches, and usually converges to an adversarial example with smaller perturbation."
"https://openreview.net/pdf?id=BJx040EFvH"	"poster"	"Fast is better than free: Revisiting adversarial training"	"Eric Wong, Leslie Rice, J. Zico Kolter"	"adversarial examples; adversarial training; fast gradient sign method"	"Adversarial training, a method for learning robust deep networks, is typically assumed to be more expensive than traditional training due to the necessity of constructing adversarial examples via a first-order method like projected gradient decent (PGD). In this paper, we make the surprising discovery that it is possible to train empirically robust models using a much weaker and cheaper adversary, an approach that was previously believed to be ineffective, rendering the method no more costly than standard training in practice. Specifically, we show that adversarial training with the fast gradient sign method (FGSM), when combined with random initialization, is as effective as PGD-based training but has significantly lower cost. Furthermore we show that FGSM adversarial training can be further accelerated by using standard techniques for efficient training of deep networks, allowing us to learn a robust CIFAR10 classifier with 45% robust accuracy at epsilon=8/255 in 6 minutes, and a robust ImageNet classifier with 43% robust accuracy at epsilon=2/255 in 12 hours, in comparison to past work based on ``free'' adversarial training which took 10 and 50 hours to reach the same respective thresholds."
"https://openreview.net/pdf?id=ryxz8CVYDH"	"poster"	"Learning to Learn by Zeroth-Order Oracle"	"Yangjun Ruan, Yuanhao Xiong, Sashank Reddi, Sanjiv Kumar, Cho-Jui Hsieh"	"learning to learn; zeroth-order optimization; black-box adversarial attack"	"In the learning to learn (L2L) framework, we cast the design of optimization algorithms as a machine learning problem and use deep neural networks to learn the update rules. In this paper, we extend the L2L framework to zeroth-order (ZO) optimization setting, where no explicit gradient information is available. Our learned optimizer, modeled as recurrent neural network (RNN), first approximates gradient by ZO gradient estimator and then produces parameter update utilizing the knowledge of previous iterations. To reduce high variance effect due to ZO gradient estimator, we further introduce another RNN to learn the Gaussian sampling rule and dynamically guide the query direction sampling. Our learned optimizer outperforms hand-designed algorithms in terms of convergence rate and final solution on both synthetic and practical ZO optimization tasks (in particular, the black-box adversarial attack task, which is one of the most widely used tasks of ZO optimization). We finally conduct extensive analytical experiments to demonstrate the effectiveness of our proposed optimizer."
